image_name,correct_lat,correct_lng,description,image_url
Chùa Bánh Xèo – BRVT.jpg,10.3833,107.15,Chùa Bánh Xèo là một ngôi chùa độc đáo với kiến trúc kết hợp giữa phong cách Việt Nam và Trung Hoa. Chùa nổi tiếng với món bánh xèo chay thơm ngon được phục vụ du khách.,./images/miennam/-Chua-Banh-Xeo.jpg
Chùa Hòn Một – BRVT.jpg,10.3667,107.1333,"Chùa Hòn Một là một ngôi chùa nằm trên một hòn đảo nhỏ, có cảnh quan thiên nhiên tươi đẹp và không gian thanh tịnh.",./images/miennam/-Chua-Hon-Mot.jpg
Đảo Ngọc Vũng Tàu (Cù Lao Bãi Ngựa) – BRVT.jpg,10.35,107.1167,Đảo Ngọc Vũng Tàu là một hòn đảo hoang sơ với những bãi biển tuyệt đẹp và làn nước trong xanh. Nơi đây có cảnh quan thiên nhiên hoang sơ và là điểm đến lý tưởng để khám phá biển đảo.,./images/miennam/-Dao-Ngoc-Vung-Tau-Cu-Lao-Bai-Ngua.jpg
Đèo Nước Ngọt – BRVT.jpg,10.3333,107.1,"Đèo Nước Ngọt là một con đèo đẹp với một bên là biển và một bên là núi. Đứng trên đèo, bạn có thể ngắm nhìn toàn cảnh biển cả và núi non hùng vĩ.",./images/miennam/-Deo-Nuoc-Ngot.jpg
Hồ Cốc – BRVT.jpg,10.4333,107.4167,"Hồ Cốc là một bãi biển hoang sơ với bờ cát trắng mịn và làn nước trong xanh. Nơi đây có không khí trong lành và cảnh quan yên bình, thích hợp để nghỉ dưỡng và tắm biển.",./images/miennam/-Ho-Coc.jpg
Khu bảo tồn thiên nhiên Bình Châu - Phước Bửu – BRVT,10.45,107.4333,Khu bảo tồn thiên nhiên rộng lớn với hệ sinh thái đa dạng và phong phú.,./images/miennam/-Khu-bao-ton-thien-nhien-Binh-Chau---Phuoc-Buu.jpg
Núi Dinh – BRVT,10.5,107.25,"Ngọn núi cao với cảnh quan thiên nhiên hùng vĩ, có nhiều chùa chiền và di tích lịch sử.",./images/miennam/-Nui-Dinh.jpg
Núi Minh Đạm – BRVT,10.4833,107.2333,Ngọn núi với nhiều di tích lịch sử cách mạng và cảnh biển đẹp từ đỉnh núi.,./images/miennam/-Nui-Minh-Dam.jpg
Núi Thị Vải – BRVT,10.5167,107.2667,"Ngọn núi cao, có nhiều chùa chiền và lễ hội truyền thống.",./images/miennam/-Nui-Thi-Vai.jpg
Suối khoáng nóng Bình Châu – BRVT,10.4667,107.45,Khu nghỉ dưỡng với hồ khoáng nóng tự nhiên và cảnh quan tươi đẹp.,./images/miennam/-Suoi-khoang-nong-Binh-Chau.jpg
Tượng Chúa Kitô Vua – BRVT,10.3417,107.0833,"Tượng Chúa lớn trên đỉnh Núi Nhỏ, biểu tượng của thành phố Vũng Tàu.",./images/miennam/-Tuong-Chua-Kito-Vua.jpg
Bảo tàng Quân khu 9 – Cần Thơ,10.0333,105.7833,Nơi trưng bày hiện vật và hình ảnh về lịch sử quân đội và kháng chiến.,./images/miennam/-Bao-tang-Quan-khu-9.jpg
Chùa Phật Học – Cần Thơ,10.05,105.8,Ngôi chùa lớn với kiến trúc đồ sộ và nhiều tượng Phật.,./images/miennam/-Chua-Phat-Hoc.jpg
Chùa Pôthi Somrôn – Cần Thơ,10.0667,105.8167,Chùa Khmer cổ kính với kiến trúc độc đáo và không gian yên tĩnh.,./images/miennam/-Chua-Pothi-Somron.jpg
Chùa Quang Đức – Cần Thơ,10.0833,105.8333,Chùa hiện đại với nhiều tượng Phật và kiến trúc đẹp.,./images/miennam/-Chua-Quang-Duc.jpg
Thới Long Cổ Tự – Cần Thơ,10.1,105.85,"Ngôi chùa cổ kính, không gian thanh tịnh, sinh hoạt tín ngưỡng địa phương.",./images/miennam/-Thoi-Long-Co-Tu.jpg
Bảo tàng Lịch sử Việt Nam - TPHCM,10.7937,106.7034,"Nơi lưu giữ và trưng bày các hiện vật lịch sử, văn hóa của Việt Nam qua các thời kỳ, từ thời tiền sử đến nay. Bảo tàng có kiến trúc cổ kính, mang đậm dấu ấn văn hóa Việt Nam.",./images/miennam/Bao-tang-lich-su-Viet-Nam.jpg
Bưu điện Thành phố - TPHCM,10.7725,106.6997,"Một trong những công trình kiến trúc tiêu biểu của Thành phố Hồ Chí Minh, mang đậm phong cách kiến trúc Pháp cổ điển. Bưu điện không chỉ là nơi cung cấp các dịch vụ bưu chính mà còn là một điểm tham quan hấp dẫn.",./images/miennam/Buu-dien-Thanh-pho.jpg
